{
  "schemaVersion": 1,
  "manifestType": "world-builder-current-runtime-variant",
  "variantId": "current-advanced-v1",
  "variantKind": "advanced",
  "platformReleaseId": "current-platform-v2",
  "platformManifestHash": "0f5de4f947b5864ced91ef3865daa318c952070362044acb05a7a938830ebe4c",
  "defaultModuleIds": ["advanced-gameplay-v1"],
  "allowedModuleIds": ["advanced-gameplay-v1"],
  "semanticContractIds": ["advanced-gameplay-v1", "base-login-v1", "base-map-v1", "base-state-v1", "canonical-layered-map-v1"],
  "advancedOnly": true,
  "variantManifestHash": "353860a8b4e7dac815df1888725dd647f43e6f091e770cda1c3029f373b52a31"
}
